{
  "$schema": "https://json-schema.org/draft/2020-12/schema",
  "$id": "https://raw.githubusercontent.com/naqerl/citydiff/main/lib/tour/tour.schema.json",
  "title": "citydiff tour, version 1",
  "description": "An ordered script of steps over the citydiff scene of one commit range. Names are resolved against that scene by `citydiff tour validate`.",
  "type": "object",
  "additionalProperties": false,
  "required": ["version", "steps"],
  "properties": {
    "version": { "const": 1 },
    "title": { "type": "string", "description": "Shown above the note panel." },
    "range": { "type": "string", "description": "The base..head the tour was written for, as passed to -range.", "examples": ["dbdafc00..061e9aed"] },
    "steps": { "type": "array", "minItems": 1, "items": { "$ref": "#/$defs/step" } }
  },
  "$defs": {
    "name": {
      "type": "string",
      "minLength": 1,
      "description": "A node name: a package path (barse/db, db), a declaration (generator.NewGenerator, Generator.Run, barse/db.Queries.ListDecks), a Rust item (crate::mod::f, <T as Trait>::m), or a scene id. A tail of whole segments is enough when it is unique."
    },
    "step": {
      "type": "object",
      "additionalProperties": false,
      "required": ["title"],
      "properties": {
        "title": { "type": "string", "minLength": 1, "description": "Note heading." },
        "note": { "type": "string", "description": "Markdown shown in the note panel: paragraphs, **bold**, *italic*, `code`, fenced code, lists, headings and http(s) links." },
        "duration": { "type": "number", "minimum": 0, "default": 8, "description": "Seconds the step plays before autoplay moves on." },
        "mode": { "enum": ["changes", "full"], "description": "changes colours the diff and draws the dependency arcs; full is the plain city." },
        "select": { "$ref": "#/$defs/name", "description": "A package or external import to select and fly to. Its dependency or changed-call arcs are drawn." },
        "focus": { "$ref": "#/$defs/name", "description": "A node to focus. A function or method opens its call focus, a type or variable is selected, a package is selected." },
        "highlight": { "type": "array", "items": { "$ref": "#/$defs/name" }, "description": "Nodes to light up together. Calls between them are drawn as arcs." },
        "path": {
          "type": "object",
          "additionalProperties": false,
          "required": ["from", "to"],
          "properties": { "from": { "$ref": "#/$defs/name" }, "to": { "$ref": "#/$defs/name" } },
          "description": "Light the shortest resolved call path between two functions or methods, with its arcs."
        },
        "dim": { "type": "boolean", "default": true, "description": "With highlight or path, shade everything else. false keeps the rest of the city bright." },
        "camera": { "enum": ["overview", "top", "fit", "close"], "description": "overview frames the city, top looks straight down, fit frames the step's nodes, close moves in on them. Defaults to the camera of select/focus, else fit when there are nodes, else overview." },
        "zoom": { "type": "number", "exclusiveMinimum": 0, "description": "Multiplies the camera's distance after the camera move; 0.5 is twice as close." },
        "code": { "$ref": "#/$defs/name", "description": "A declaration whose git diff is shown under the note: the same hunks, line numbers and colours the viewer's D key opens, and the same 'unchanged' message when the node did not change." }
      }
    }
  }
}
